id,retweets_count,favorite_count,created_at,text,lang,retweeted,followers_count,friends_count,hashtags_count,description,location,background_image_url,source
7.40E+17,1464,3685,8/6/2016 2:29,Urged those associated with renewable energy to support International Solar Alliance &amp; spoke on need of more technology in health sector.,en,FALSE,26810027,1641,0,Prime Minister of India,India,http://pbs.twimg.com/profile_background_images/562185004696875009/DiiHx54g.jpeg,Twitter for BlackBerry
7.40E+17,2350,6635,8/6/2016 2:27,Met American businesspersons to discuss stronger economic partnership between India and USA. https://t.co/ceQCgQiIhG,en,FALSE,26810027,1641,0,Prime Minister of India,India,http://pbs.twimg.com/profile_background_images/562185004696875009/DiiHx54g.jpeg,Twitter for BlackBerry
7.40E+17,1578,5299,8/6/2016 2:24,Met Secretary of Defense Ashton Carter. @DeptofDefense https://t.co/qifidepvU1,en,FALSE,26810027,1641,0,Prime Minister of India,India,http://pbs.twimg.com/profile_background_images/562185004696875009/DiiHx54g.jpeg,Twitter for BlackBerry
7.40E+17,1511,4062,7/6/2016 20:39,"We want to deepen cooperation in science, technology, health &amp; boost people-to-people ties. This has been addressed in the Joint Statement.",en,FALSE,26810027,1641,0,Prime Minister of India,India,http://pbs.twimg.com/profile_background_images/562185004696875009/DiiHx54g.jpeg,Twitter Web Client
7.40E+17,1292,2962,7/6/2016 20:39,The Statement reaffirms the joint commitment of India &amp; USA to stand together against terrorism &amp; violent extremism.,en,FALSE,26810027,1641,0,Prime Minister of India,India,http://pbs.twimg.com/profile_background_images/562185004696875009/DiiHx54g.jpeg,Twitter Web Client
7.40E+17,1371,3160,7/6/2016 20:38,"The India-US Joint Statement covers important topics of India's relations with USA, including clean energy, defence, security &amp; trade.",en,FALSE,26810027,1641,0,Prime Minister of India,India,http://pbs.twimg.com/profile_background_images/562185004696875009/DiiHx54g.jpeg,Twitter Web Client
7.40E+17,1035,2258,7/6/2016 20:38,'The United States and India: Enduring Global Partners in the 21st Century'...the India-US Joint Statement. https://t.co/3BGlBXOUgo,en,FALSE,26810027,1641,0,Prime Minister of India,India,http://pbs.twimg.com/profile_background_images/562185004696875009/DiiHx54g.jpeg,Twitter Web Client
7.40E+17,5291,15475,7/6/2016 16:42,Delighted to meet @POTUS again. We had very good discussions on India-USA ties. https://t.co/dcxkWI5gnO,en,FALSE,26810027,1641,0,Prime Minister of India,India,http://pbs.twimg.com/profile_background_images/562185004696875009/DiiHx54g.jpeg,Twitter for iPhone
7.40E+17,2024,5551,7/6/2016 0:58,Also had a wonderful interaction with leading think tanks. https://t.co/zoT1VPslml,en,FALSE,26810027,1641,0,Prime Minister of India,India,http://pbs.twimg.com/profile_background_images/562185004696875009/DiiHx54g.jpeg,Twitter for iPhone
7.40E+17,2763,6372,7/6/2016 0:54,Here are pictures of some of the artefacts. https://t.co/Q4PWMOee2X,en,FALSE,26810027,1641,0,Prime Minister of India,India,http://pbs.twimg.com/profile_background_images/562185004696875009/DiiHx54g.jpeg,Twitter for iPhone
7.40E+17,2870,7661,7/6/2016 0:52,A focus on heritage &amp; culture...I thank the US government for the return of precious cultural artefacts to India. https://t.co/9mxjtEU527,en,FALSE,26810027,1641,0,Prime Minister of India,India,http://pbs.twimg.com/profile_background_images/562185004696875009/DiiHx54g.jpeg,Twitter for iPhone
7.40E+17,1581,4114,7/6/2016 0:49,Saluting ultimate courage...offered tributes at the @ArlingtonNatl. https://t.co/WBqpPKzwJE,en,FALSE,26810027,1641,0,Prime Minister of India,India,http://pbs.twimg.com/profile_background_images/562185004696875009/DiiHx54g.jpeg,Twitter for iPhone
7.40E+17,2059,6207,7/6/2016 0:45,Glimpses from the various programmes and interactions in Washington DC today. https://t.co/oxWSymCY00,en,FALSE,26810027,1641,0,Prime Minister of India,India,http://pbs.twimg.com/profile_background_images/562185004696875009/DiiHx54g.jpeg,Twitter for iPhone
7.40E+17,1110,3286,6/6/2016 20:37,My deepest gratitude to the Emir of Qatar for the gesture.,en,FALSE,26810027,1641,0,Prime Minister of India,India,http://pbs.twimg.com/profile_background_images/562185004696875009/DiiHx54g.jpeg,Twitter for BlackBerry
7.40E+17,2084,4742,6/6/2016 20:37,"A special gesture to mark the start of a special month...the Government of Qatar releases 23 prisoners, who will return home to India.",en,FALSE,26810027,1641,0,Prime Minister of India,India,http://pbs.twimg.com/profile_background_images/562185004696875009/DiiHx54g.jpeg,Twitter for BlackBerry
7.40E+17,2169,6142,6/6/2016 20:34,"As Ramzan commences, I convey my greetings. https://t.co/qM3H8BsiZK",en,FALSE,26810027,1641,0,Prime Minister of India,India,http://pbs.twimg.com/profile_background_images/562185004696875009/DiiHx54g.jpeg,Twitter for BlackBerry
7.40E+17,1566,0,6/6/2016 19:25,RT @PMOIndia: Afternoon touchdown at the Andrews Air Force Base...PM @narendramodi lands in USA. A wide range of programmes await. https://…,en,FALSE,26810027,1641,0,Prime Minister of India,India,http://pbs.twimg.com/profile_background_images/562185004696875009/DiiHx54g.jpeg,Twitter for iPhone
7.40E+17,1669,4323,6/6/2016 10:04,India's economy is growing rapidly. The coming together of our development needs &amp; Swiss strengths can be beneficial https://t.co/RrkR67ARD0,en,FALSE,26810027,1641,0,Prime Minister of India,India,http://pbs.twimg.com/profile_background_images/562185004696875009/DiiHx54g.jpeg,Twitter Web Client
7.40E+17,1629,5585,6/6/2016 10:02,Held detailed discussions with Swiss CEOs. Glad that economic linkages between our nations are strong &amp; vibrant. https://t.co/o0GHwrrQrC,en,FALSE,26810027,1641,0,Prime Minister of India,India,http://pbs.twimg.com/profile_background_images/562185004696875009/DiiHx54g.jpeg,Twitter Web Client
7.40E+17,1385,3680,6/6/2016 9:58,"Common commitments, values, people-to-people &amp; economic ties will take India-Switzerland relations to new heights.
https://t.co/wSX8RUcQ26",en,FALSE,26810027,1641,0,Prime Minister of India,India,http://pbs.twimg.com/profile_background_images/562185004696875009/DiiHx54g.jpeg,Twitter Web Client
7.40E+17,1514,3659,6/6/2016 9:50,"Collaboration in trade, technology, skill development, renewable energy were discussed in my meeting with President Schneider-Ammann.",en,FALSE,26810027,1641,0,Prime Minister of India,India,http://pbs.twimg.com/profile_background_images/562185004696875009/DiiHx54g.jpeg,Twitter Web Client
7.40E+17,2346,7585,6/6/2016 9:49,President Schneider-Ammann and I reviewed the multifaceted bilateral ties between India &amp; Switzerland. https://t.co/hzKDzSIaoe,en,FALSE,26810027,1641,0,Prime Minister of India,India,http://pbs.twimg.com/profile_background_images/562185004696875009/DiiHx54g.jpeg,Twitter Web Client
7.40E+17,2220,0,5/6/2016 21:57,"RT @PMOIndia: PM @narendramodi lands in Geneva, marking the start of his Switzerland visit. https://t.co/hUJFdnhsvu",en,FALSE,26810027,1641,0,Prime Minister of India,India,http://pbs.twimg.com/profile_background_images/562185004696875009/DiiHx54g.jpeg,Twitter for iPhone
7.39E+17,800,2732,5/6/2016 14:37,لقد شهدت زيارتي إلى قطر مناقشات مثمرة وشاملة التي من شأنها أن تستهل حقبة جديدة من الصداقة المتينة بين الهند وقطر https://t.co/xt2W6hAo28,ar,FALSE,26810027,1641,0,Prime Minister of India,India,http://pbs.twimg.com/profile_background_images/562185004696875009/DiiHx54g.jpeg,Twitter for iPhone
7.39E+17,1934,5765,5/6/2016 14:32,Here are some pictures from the community programme. https://t.co/jFMvH3yuso,en,FALSE,26810027,1641,0,Prime Minister of India,India,http://pbs.twimg.com/profile_background_images/562185004696875009/DiiHx54g.jpeg,Twitter for iPhone
7.39E+17,1577,3603,5/6/2016 14:30,Delighted to interact with the Indian community in Doha. India's diaspora enhances our pride worldwide. https://t.co/tfVNS8FEYn,en,FALSE,26810027,1641,0,Prime Minister of India,India,http://pbs.twimg.com/profile_background_images/562185004696875009/DiiHx54g.jpeg,Twitter for iPhone
7.39E+17,1695,4998,5/6/2016 11:51,"Crucial agreements were signed today, which will give new strength to India-Qatar ties. https://t.co/a3EUPXwz3I",en,FALSE,26810027,1641,0,Prime Minister of India,India,http://pbs.twimg.com/profile_background_images/562185004696875009/DiiHx54g.jpeg,Twitter for iPhone
7.39E+17,1701,4957,5/6/2016 11:49,Sheikh Tamim Bin Hamad Al Thani &amp; I had wide ranging talks on how India &amp; Qatar can further expand bilateral ties. https://t.co/2kufFjigTf,en,FALSE,26810027,1641,0,Prime Minister of India,India,http://pbs.twimg.com/profile_background_images/562185004696875009/DiiHx54g.jpeg,Twitter for iPhone
7.39E+17,1935,5748,5/6/2016 11:45,A picture from the ceremonial reception at the Emiri Diwan this morning. https://t.co/Ljr8yVBJhM,en,FALSE,26810027,1641,0,Prime Minister of India,India,http://pbs.twimg.com/profile_background_images/562185004696875009/DiiHx54g.jpeg,Twitter for iPhone
7.39E+17,2112,6840,5/6/2016 7:26,Also talked about the investment opportunities in India and why the world must come and @makeinindia. https://t.co/ZX0kuWpAa6,en,FALSE,26810027,1641,0,Prime Minister of India,India,http://pbs.twimg.com/profile_background_images/562185004696875009/DiiHx54g.jpeg,Twitter for iPhone
7.39E+17,1863,5892,5/6/2016 7:24,"At the round-table with businesspersons from Qatar, discussed ways to enhance India-Qatar economic cooperation. https://t.co/CuR9GApugG",en,FALSE,26810027,1641,0,Prime Minister of India,India,http://pbs.twimg.com/profile_background_images/562185004696875009/DiiHx54g.jpeg,Twitter for iPhone
7.39E+17,2626,4996,5/6/2016 3:27,"Know why Kapalbhati is advantageous for you and why you must consider practicing it  regularly.
https://t.co/04L9xcwlCk",en,FALSE,26810027,1641,0,Prime Minister of India,India,http://pbs.twimg.com/profile_background_images/562185004696875009/DiiHx54g.jpeg,Twitter Web Client
7.39E+17,5444,13651,5/6/2016 3:26,"On #WorldEnvironmentDay, a commitment to protect our environment &amp; live in harmony with nature. https://t.co/gYa2nXesRI",en,FALSE,26810027,1641,1,Prime Minister of India,India,http://pbs.twimg.com/profile_background_images/562185004696875009/DiiHx54g.jpeg,Twitter for iPhone
7.39E+17,1676,5373,4/6/2016 20:26,Met PM Sheikh Abdullah Bin Nasser Al Thani earlier this evening in Doha. https://t.co/6xzt6an4cY,en,FALSE,26810027,1641,0,Prime Minister of India,India,http://pbs.twimg.com/profile_background_images/562185004696875009/DiiHx54g.jpeg,Twitter Web Client
7.39E+17,3385,9366,4/6/2016 17:22,My deepest gratitude to the Government of Afghanistan for conferring the Amir Amanullah Khan Award. https://t.co/EfzeXIBdK1,en,FALSE,26810027,1641,0,Prime Minister of India,India,http://pbs.twimg.com/profile_background_images/562185004696875009/DiiHx54g.jpeg,Twitter for iPhone
7.39E+17,5825,16702,4/6/2016 16:40,Smiles and snacks in Doha...my first programme in Qatar was a visit to a Workers' Camp in downtown Doha. https://t.co/vgQwZdZssX,en,FALSE,26810028,1641,0,Prime Minister of India,India,http://pbs.twimg.com/profile_background_images/562185004696875009/DiiHx54g.jpeg,Twitter for iPhone
7.39E+17,1756,4822,4/6/2016 13:59,Thank you President @ashrafghani. We had fruitful discussions on how to further enhance India-Afghanistan ties. https://t.co/K4ng6UssSb,en,FALSE,26810028,1641,0,Prime Minister of India,India,http://pbs.twimg.com/profile_background_images/562185004696875009/DiiHx54g.jpeg,Twitter for iPhone
7.39E+17,754,2381,4/6/2016 13:55,وإنني لأتطلع إلى مختلف البرامج التي من شأنها تعزيز الاقتصاد والعلاقات بين شعبي الهند وقطر. https://t.co/2d9masAJkf,ar,FALSE,26810028,1641,0,Prime Minister of India,India,http://pbs.twimg.com/profile_background_images/562185004696875009/DiiHx54g.jpeg,Twitter for BlackBerry
7.39E+17,1180,3648,4/6/2016 10:40,مننه افغانستانه! زما نني لنډ سفر د دواړو دوستو هیوادونو د تاريخي دوستۍ ښکارندويي کوي، چي د دواړو هیوادونو د ولسونو گډی گټې په کي نغښتې دي,ps,FALSE,26810028,1641,0,Prime Minister of India,India,http://pbs.twimg.com/profile_background_images/562185004696875009/DiiHx54g.jpeg,Twitter Web Client
7.39E+17,1558,4196,4/6/2016 10:39,Thank you Afghanistan. This brief visit will go a long way in further cementing India-Afghanistan friendship &amp; benefit our citizens greatly.,en,FALSE,26810028,1641,0,Prime Minister of India,India,http://pbs.twimg.com/profile_background_images/562185004696875009/DiiHx54g.jpeg,Twitter Web Client
7.39E+17,2852,6738,4/6/2016 9:52,RIP Muhammad Ali. You were an exemplary sportsperson &amp; source of inspiration who demonstrated the power of human spirit &amp; determination.,en,FALSE,26810028,1641,0,Prime Minister of India,India,http://pbs.twimg.com/profile_background_images/562185004696875009/DiiHx54g.jpeg,Twitter Web Client
7.39E+17,1407,3800,4/6/2016 9:04,"Today, we are reviving a region, restoring hope, renewing life and redefining Afghanistan’s future. https://t.co/GKy6K7JeK8",en,FALSE,26810028,1641,0,Prime Minister of India,India,http://pbs.twimg.com/profile_background_images/562185004696875009/DiiHx54g.jpeg,Twitter Web Client
7.39E+17,1578,4329,4/6/2016 9:03,"India cherishes the friendship with Afghanistan. In Afghanistan, we want to see democracy strike deep roots, people unite &amp; economy prosper.",en,FALSE,26810028,1641,0,Prime Minister of India,India,http://pbs.twimg.com/profile_background_images/562185004696875009/DiiHx54g.jpeg,Twitter Web Client
7.39E+17,1563,4257,4/6/2016 9:01,"The brave Afghan people are sending a strong message that the forces of destruction &amp; death, denial and domination, shall not prevail.",en,FALSE,26810028,1641,0,Prime Minister of India,India,http://pbs.twimg.com/profile_background_images/562185004696875009/DiiHx54g.jpeg,Twitter Web Client
7.39E+17,1241,3420,4/6/2016 9:00,This is a project that will irrigate lands &amp; light up homes. The dam is a generator of optimism &amp; belief in the future of Afghanistan.,en,FALSE,26810028,1641,0,Prime Minister of India,India,http://pbs.twimg.com/profile_background_images/562185004696875009/DiiHx54g.jpeg,Twitter Web Client
7.39E+17,1583,4312,4/6/2016 9:00,Inauguration of the Afghan India Friendship Dam is a historic moment of emotion &amp; pride in the relations between Afghanistan and India.,en,FALSE,26810028,1641,0,Prime Minister of India,India,http://pbs.twimg.com/profile_background_images/562185004696875009/DiiHx54g.jpeg,Twitter Web Client
7.39E+17,2841,11695,4/6/2016 6:58,Reached Herat in Afghanistan. Will attend the programme for inauguration of Salma Dam &amp; meet President @ashrafghani. https://t.co/rKTNxUt3sL,en,FALSE,26810028,1641,0,Prime Minister of India,India,http://pbs.twimg.com/profile_background_images/562185004696875009/DiiHx54g.jpeg,Twitter for iPhone
7.39E+17,2031,4043,4/6/2016 1:11,"Here's why practicing Trikonasana can be beneficial.
https://t.co/TXikv32eri",en,FALSE,26810028,1641,0,Prime Minister of India,India,http://pbs.twimg.com/profile_background_images/562185004696875009/DiiHx54g.jpeg,Twitter Web Client
7.39E+17,867,0,4/6/2016 1:11,"RT @PMOIndia: The gross capacity of the Dam is 633 Million M3. The height of the Dam is 104.3 Mt, length 540 Mt and width at the bottom is…",en,FALSE,26810028,1641,0,Prime Minister of India,India,http://pbs.twimg.com/profile_background_images/562185004696875009/DiiHx54g.jpeg,Twitter for iPhone
7.39E+17,928,0,4/6/2016 1:11,"RT @PMOIndia: Project is executed &amp; implemented by WAPCOS Ltd, a GoI Undertaking under ministry of Water Resources, River Development &amp; Gan…",en,FALSE,26810028,1641,0,Prime Minister of India,India,http://pbs.twimg.com/profile_background_images/562185004696875009/DiiHx54g.jpeg,Twitter for iPhone
7.39E+17,892,0,4/6/2016 1:10,"RT @PMOIndia: This is a landmark infrastructure project undertaken by Government of India on river Chist-e-Sharif, in Herat province of Afg…",en,FALSE,26810028,1641,0,Prime Minister of India,India,http://pbs.twimg.com/profile_background_images/562185004696875009/DiiHx54g.jpeg,Twitter for iPhone
7.39E+17,1180,0,4/6/2016 1:10,"RT @PMOIndia: Afghan-India Friendship Dam is a Multipurpose project planned for generating 42 MW of power, irrigating 75000 hectares of lan…",en,FALSE,26810031,1641,0,Prime Minister of India,India,http://pbs.twimg.com/profile_background_images/562185004696875009/DiiHx54g.jpeg,Twitter for iPhone
7.39E+17,1252,3364,3/6/2016 13:43,"My visit to Mexico, a privileged partner in the Latin American region, will give an impetus to India-Mexico ties. https://t.co/5ZpL6OZOgw",en,FALSE,26810031,1641,0,Prime Minister of India,India,http://pbs.twimg.com/profile_background_images/562185004696875009/DiiHx54g.jpeg,Twitter Web Client
7.39E+17,1084,2578,3/6/2016 13:41,The programmes in USA include talks with @POTUS &amp; address to a Joint Meeting of the US Congress. https://t.co/hT0AqA1RcS,en,FALSE,26810031,1641,0,Prime Minister of India,India,http://pbs.twimg.com/profile_background_images/562185004696875009/DiiHx54g.jpeg,Twitter Web Client
7.39E+17,1584,4529,3/6/2016 13:40,My visit to USA is aimed at building upon the progress achieved in India-USA ties &amp; adding new vigour to our strategic partnership.,en,FALSE,26810031,1641,0,Prime Minister of India,India,http://pbs.twimg.com/profile_background_images/562185004696875009/DiiHx54g.jpeg,Twitter Web Client
7.39E+17,1134,2913,3/6/2016 13:39,"In Switzerland, will meet President Schneider-Ammann. Will also meet businesspersons &amp; Indian scientists at CERN. https://t.co/5Ho6fNyL8s",en,FALSE,26810031,1641,0,Prime Minister of India,India,http://pbs.twimg.com/profile_background_images/562185004696875009/DiiHx54g.jpeg,Twitter Web Client
7.39E+17,1019,2723,3/6/2016 13:37,My Qatar visit is aimed at strengthening economic &amp; people-to-people ties between India &amp; Qatar. https://t.co/RmgmJ96ho1,en,FALSE,26810031,1641,0,Prime Minister of India,India,http://pbs.twimg.com/profile_background_images/562185004696875009/DiiHx54g.jpeg,Twitter Web Client
7.39E+17,1207,3425,3/6/2016 13:36,"Looking forward to meeting President @ashrafghani &amp; discussing India-Afghanistan ties, during my Afghanistan visit. @ARG_AFG",en,FALSE,26810031,1641,0,Prime Minister of India,India,http://pbs.twimg.com/profile_background_images/562185004696875009/DiiHx54g.jpeg,Twitter Web Client
7.39E+17,1115,2890,3/6/2016 13:36,"Tomorrow I will visit Afghanistan, where I will join the inauguration of Afghanistan-India Friendship Dam in Herat. https://t.co/4RN2JfcTjk",en,FALSE,26810031,1641,0,Prime Minister of India,India,http://pbs.twimg.com/profile_background_images/562185004696875009/DiiHx54g.jpeg,Twitter Web Client
7.39E+17,2652,5887,3/6/2016 1:19,"Practicing Vakrasana has many advantages. Know how this Asana can help you.
https://t.co/aDqdJlkHZ8",en,FALSE,26810031,1641,0,Prime Minister of India,India,http://pbs.twimg.com/profile_background_images/562185004696875009/DiiHx54g.jpeg,Twitter Web Client
7.38E+17,1338,3694,2/6/2016 16:26,Emphasised on the importance of imbibing safety norms and soft skills as integral components of skill development. https://t.co/btzVokExpx,en,FALSE,26810031,1641,0,Prime Minister of India,India,http://pbs.twimg.com/profile_background_images/562185004696875009/DiiHx54g.jpeg,Twitter Web Client
7.38E+17,1215,3465,2/6/2016 16:25,"There were deliberations on the importance of proper identification of the future requirements for skills, which can help our youth.",en,FALSE,26810031,1641,0,Prime Minister of India,India,http://pbs.twimg.com/profile_background_images/562185004696875009/DiiHx54g.jpeg,Twitter Web Client
7.38E+17,1431,3805,2/6/2016 16:25,"We are determined to create a skilled India, which is empowering for youth. Today's meeting focused on important aspects of skill mapping.",en,FALSE,26810031,1641,0,Prime Minister of India,India,http://pbs.twimg.com/profile_background_images/562185004696875009/DiiHx54g.jpeg,Twitter Web Client
7.38E+17,1801,5733,2/6/2016 16:24,Chaired the first meeting of the Governing Council of the National Skill Development Mission. https://t.co/Fo7MRrFeUH,en,FALSE,26810031,1641,0,Prime Minister of India,India,http://pbs.twimg.com/profile_background_images/562185004696875009/DiiHx54g.jpeg,Twitter Web Client
7.38E+17,1802,3466,2/6/2016 15:40,"Know more about Bhujangasana and its benefits.
https://t.co/39MEabibOU",en,FALSE,26810031,1641,0,Prime Minister of India,India,http://pbs.twimg.com/profile_background_images/562185004696875009/DiiHx54g.jpeg,Twitter Web Client
7.38E+17,1503,3145,2/6/2016 12:18,"The Ujjwala Yojana and how it is benefitting citizens. #TransformingIndia
https://t.co/xWKtyjGo36",hi,FALSE,26810031,1641,1,Prime Minister of India,India,http://pbs.twimg.com/profile_background_images/562185004696875009/DiiHx54g.jpeg,Twitter Web Client
7.38E+17,1467,3530,2/6/2016 12:07,"Also spoke on how 'Beti Bachao, Beti Padhao' &amp; Mission Indradhanush are positively impacting lives of women &amp; youth. https://t.co/03UgLusRJ8",en,FALSE,26810031,1641,0,Prime Minister of India,India,http://pbs.twimg.com/profile_background_images/562185004696875009/DiiHx54g.jpeg,Twitter for iPhone
7.38E+17,1241,3185,2/6/2016 12:07,Talked at length about the measures NDA Govt. has taken to ensure our youngsters are not only healthy but also receive quality education.,en,FALSE,26810031,1641,0,Prime Minister of India,India,http://pbs.twimg.com/profile_background_images/562185004696875009/DiiHx54g.jpeg,Twitter for iPhone
7.38E+17,1169,2922,2/6/2016 12:06,My speech focused on the importance of all-round development &amp; particularly the work of the NDA Govt. for the progress of Eastern India.,en,FALSE,26810031,1641,0,Prime Minister of India,India,http://pbs.twimg.com/profile_background_images/562185004696875009/DiiHx54g.jpeg,Twitter for iPhone
7.38E+17,2205,6074,2/6/2016 12:05,Went to Balasore in Odisha &amp; gave a detailed account of the NDA Govt's efforts for #TransformingIndia. https://t.co/2xwRa1MUOx,en,FALSE,26810031,1641,1,Prime Minister of India,India,http://pbs.twimg.com/profile_background_images/562185004696875009/DiiHx54g.jpeg,Twitter for iPhone
7.38E+17,1288,4032,2/6/2016 2:06,I convey my greetings to my sisters &amp; brothers of Andhra Pradesh. My best wishes as the state continues to develop at a rapid pace.,en,FALSE,26810031,1641,0,Prime Minister of India,India,http://pbs.twimg.com/profile_background_images/562185004696875009/DiiHx54g.jpeg,Twitter for BlackBerry
7.38E+17,1329,3930,2/6/2016 2:04,"On the Statehood Day of Telangana, my greetings to the people of Telangana. I hope the state progresses to new heights in the years to come.",en,FALSE,26810031,1641,0,Prime Minister of India,India,http://pbs.twimg.com/profile_background_images/562185004696875009/DiiHx54g.jpeg,Twitter for BlackBerry
7.38E+17,861,3212,2/6/2016 2:02,Birthday greetings to my Cabinet colleague Anant Geete ji. Praying for his long life and good health.,en,FALSE,26810031,1641,0,Prime Minister of India,India,http://pbs.twimg.com/profile_background_images/562185004696875009/DiiHx54g.jpeg,Twitter for BlackBerry
7.38E+17,2046,3981,1/6/2016 16:26,"Here are details about Vrikshasana &amp; how it helps the body.
https://t.co/GiSglMQZy2",en,FALSE,26810031,1641,0,Prime Minister of India,India,http://pbs.twimg.com/profile_background_images/562185004696875009/DiiHx54g.jpeg,Twitter Web Client
7.38E+17,1509,3773,1/6/2016 16:25,Last year had shared details about Asanas &amp; Pranayam and it did generate tremendous enthusiasm. Will do the same this year too.,en,FALSE,26810031,1641,0,Prime Minister of India,India,http://pbs.twimg.com/profile_background_images/562185004696875009/DiiHx54g.jpeg,Twitter for iPhone
7.38E+17,1994,4128,1/6/2016 16:25,21st June...2nd International Day of Yoga is approaching. In the run up to the 21st will share details on various Asanas &amp; Pranayam.,en,FALSE,26810031,1641,0,Prime Minister of India,India,http://pbs.twimg.com/profile_background_images/562185004696875009/DiiHx54g.jpeg,Twitter for iPhone
7.38E+17,1197,3419,1/6/2016 15:34,Shri Dalpat Singh Paraste was a dedicated leader who spent years in service of the Nation &amp; tribal communities. Saddened by his demise. RIP.,en,FALSE,26810031,1641,0,Prime Minister of India,India,http://pbs.twimg.com/profile_background_images/562185004696875009/DiiHx54g.jpeg,Twitter for iPhone
7.38E+17,1157,3013,1/6/2016 11:09,"A regional approach has been adopted in the NDMP, which helps in disaster management &amp; in development planning. https://t.co/EeSazmMCTk",en,FALSE,26810031,1641,0,Prime Minister of India,India,http://pbs.twimg.com/profile_background_images/562185004696875009/DiiHx54g.jpeg,Twitter Web Client
7.38E+17,1259,3238,1/6/2016 11:08,"To prepare communities to cope with disasters, the plan emphasizes on a greater need for Information, education &amp; communication activities.",en,FALSE,26810031,1641,0,Prime Minister of India,India,http://pbs.twimg.com/profile_background_images/562185004696875009/DiiHx54g.jpeg,Twitter Web Client
7.38E+17,1236,3148,1/6/2016 11:08,"The comprehensiveness of this plan is noteworthy. It covers all phases of disaster management- prevention, mitigation, response &amp; recovery.",en,FALSE,26810031,1641,0,Prime Minister of India,India,http://pbs.twimg.com/profile_background_images/562185004696875009/DiiHx54g.jpeg,Twitter Web Client
7.38E+17,2547,7902,1/6/2016 11:07,Released National Disaster Management Plan. It focuses on disaster resilience &amp; reducing damage during disasters. https://t.co/vVtA5oUwNA,en,FALSE,26810031,1641,0,Prime Minister of India,India,http://pbs.twimg.com/profile_background_images/562185004696875009/DiiHx54g.jpeg,Twitter Web Client
